time,title,text,source,sentiment_label,url,topics,type,tickers
"Tue, 31 Mar 2026 13:52:00 -0400",EUR/USD rises above 1.1550 following recent Trump remarks,EUR/USD rises above 1.1550 following recent Trump remarks,FX Street,Positive,https://www.fxstreet.com/news/eur-usd-rises-above-11550-following-recent-trump-remarks-202604010116,"USA,Europe",Article,
"Tue, 31 Mar 2026 13:45:00 -0400","US Dollar Price Action Setups: Gold, Oil, EUR/USD, USD/JPY, USD/CAD",This webinar covered a wide range of topics and we're on the eve of the Q2 open which brings an extra element of volatility. Many of the trends that have been pushing over the past month have pared back and already a lot of hope has hit the headlines.,Forexcom,Positive,https://www.forex.com/en-us/news-and-analysis/us-dollar-price-action-setups-gold-oil-eur-usd-usd-jpy-usd-cad/,"Gold,Japan,Oil,USA,Canada,Europe",Article,
"Tue, 31 Mar 2026 13:30:07 -0400",Euro Short-term Outlook: EUR/USD Rally Nears Key Resistance- Breakout or Reversal?,"EUR/USD has staged a modest recovery after breaking below multi-month support earlier this month, but the broader technical structure remains tilted to the downside. The rebound comes after a sharp decline that briefly pushed price to fresh monthly lows before stabilizing, with the pair now approaching a key resistance zone defined by a multi-month downtrend structure.",Forexcom,Negative,https://www.forex.com/en-us/news-and-analysis/euro-short-term-outlook-eur-usd-rally-nears-key-resistance-breakout-or-reversal-3-31-2026/,"USA,Europe",Article,
"Tue, 31 Mar 2026 13:18:56 -0400",EUR/USD rises as US Dollar eases on Middle East de-escalation hopes,EUR/USD rises as US Dollar eases on Middle East de-escalation hopes,FX Street,Positive,https://www.fxstreet.com/news/eur-usd-rises-as-us-dollar-eases-on-middle-east-de-escalation-hopes-202603311718,"USA,Europe",Article,
"Tue, 31 Mar 2026 12:48:03 -0400","U.S. Dollar Pulls Back As JOLTs Job Openings Drop To 6.882 Million: Analysis For EUR/USD, GBP/USD, USD/CAD, USD/JPY",Disappointing job market data and falling Treasury yields put pressure on the American currency.,FXEmpire,Positive,https://www.fxempire.com/forecasts/article/u-s-dollar-pulls-back-as-jolts-job-openings-drop-to-6-882-million-analysis-for-eur-usd-gbp-usd-usd-cad-usd-jpy-1588931,"Japan,USA,Canada,United Kingdom,Europe",Article,
"Tue, 31 Mar 2026 08:41:14 -0400",US Dollar Price Forecast: Hormuz Tensions Boost DXY – Are GBP/USD and EUR/USD Trapped?,US Dollar Index battles $100.63 resistance as Middle East tensions fuel safe-haven demand. Will JOLTs data push DXY toward the $101.50 target?,FXEmpire,Positive,https://www.fxempire.com/forecasts/article/us-dollar-price-forecast-hormuz-tensions-boost-dxy-are-gbp-usd-and-eur-usd-trapped-1588662,"USA,DXY,United Kingdom,Europe",Article,
"Tue, 31 Mar 2026 07:52:00 -0400",EUR/USD: Tough Month Finished and Other Hard Choices Ahead - 31 March 2026,"The EUR/USD is trading near the 1.14620 mark as of this writing, this as the month of March concludes with the currency pair mired in a rather dramatic bearish trajectory.",DailyForex,Negative,https://www.dailyforex.com/forex-technical-analysis/2026/03/eurusd-forex-forecast-april-2026/243313,"USA,Europe",Article,
"Tue, 31 Mar 2026 06:05:46 -0400",EUR/USD: Rate repricing and oil shock cap upside – ING,EUR/USD: Rate repricing and oil shock cap upside – ING,FX Street,Negative,https://www.fxstreet.com/news/eur-usd-rate-repricing-and-oil-shock-cap-upside-ing-202603311005,"Oil,USA,Europe",Article,
"Tue, 31 Mar 2026 05:53:52 -0400",EUR/USD flatlines below 1.1500 as Eurozone HICP grows below forecasts,EUR/USD flatlines below 1.1500 as Eurozone HICP grows below forecasts,FX Street,Negative,https://www.fxstreet.com/news/eur-usd-flatlines-below-11500-as-eurozone-hicp-grows-below-forecasts-202603310953,"USA,Europe",Article,
"Tue, 31 Mar 2026 04:40:07 -0400","EUR/USD, USD/JPY Forecast: Two trades to watch","EUR/USD is edging higher, snapping a five-day losing streak, helped by a softer US dollar following reports that President Trump may be open to ending the Iran conflict without first requiring the reopening of the Strait of Hormuz. The pair is also trading cautiously ahead of a busy session on the economic calendar.",Forexcom,Positive,https://www.forex.com/en-us/news-and-analysis/eur-usd-usd-jpy-forecast-two-trades-to-watch-2026-03-31/,"Japan,USA,Europe",Article,
"Tue, 31 Mar 2026 04:04:11 -0400",EUR/USD – 31.03.2026,The Euro managed to hold trades inside a trading zone as expected in the past two weeks. Prices still face pressure towards the 1.1200 zone with resistances at 1.1655.,Orbex,Neutral,https://www.orbex.com/blog/en/2026/03/eur-usd-31-03-2026,"USA,Europe",Article,
"Tue, 31 Mar 2026 03:30:25 -0400",When is the preliminary Eurozone HICP data for March and how could it affect EUR/USD?,When is the preliminary Eurozone HICP data for March and how could it affect EUR/USD?,FX Street,Neutral,https://www.fxstreet.com/news/when-is-the-preliminary-eurozone-hicp-data-for-march-and-how-could-it-affect-eur-usd-202603310730,Europe,Article,
"Tue, 31 Mar 2026 01:07:32 -0400",EUR/USD snaps five-day losing streak as Trump mulls ending Iran war,EUR/USD snaps five-day losing streak as Trump mulls ending Iran war,FX Street,Positive,https://www.fxstreet.com/news/eur-usd-snaps-five-day-losing-streak-as-trump-mulls-ending-iran-war-202603310507,"USA,Europe",Article,
"Mon, 30 Mar 2026 21:44:21 -0400","EUR/USD rises to near 1.1500 ahead of German Retail Sales, Eurozone HICP","EUR/USD rises to near 1.1500 ahead of German Retail Sales, Eurozone HICP",FX Street,Positive,https://www.fxstreet.com/news/eur-usd-rises-to-near-11500-ahead-of-german-retail-sales-eurozone-hicp-202603310144,"USA,Germany,Europe,Retail Sales",Article,
"Mon, 30 Mar 2026 16:07:45 -0400","US Dollar Forecast: DXY Rises as Euro Weakens on Growth Fears, Tensions Boost Demand","The US Dollar rises as euro and pound weaken on growth fears, while Middle East tensions and higher oil prices boost safe-haven demand.",FXEmpire,Positive,https://www.fxempire.com/forecasts/article/us-dollar-forecast-dxy-rises-as-euro-weakens-on-growth-fears-tensions-boost-demand-1588599,"USA,DXY,Europe",Article,
"Mon, 30 Mar 2026 12:23:00 -0400","EUR/USD forecast: Currency Pair of the Week | March 30, 2026","The FX markets remained largely in a risk off mode with the US dollar extending its gains while currencies of energy-importing economic regions like the euro remaining under pressure. This was despite the fact global stock markets managed to bounce back a little, as Brent oil prices consolidated near the recent highs.",Forexcom,Negative,https://www.forex.com/en-us/news-and-analysis/eur-usd-forecast-currency-pair-of-the-week-march-30-2026/,"USA,Europe",Article,
"Mon, 30 Mar 2026 11:17:47 -0400",EUR/USD slips to two-week lows below 1.1500 as USD strengthens,EUR/USD slips to two-week lows below 1.1500 as USD strengthens,FX Street,Negative,https://www.fxstreet.com/news/eur-usd-slips-to-two-week-lows-below-11500-as-usd-strengthens-202603301517,"USA,Europe",Article,
"Mon, 30 Mar 2026 09:57:48 -0400","EUR/CHF, EUR/USD and EUR/GBP Forecasts – Euro in Focus on Monday","The Euro is in focus today for me, as the markets are trying to price in energy shocks, and of course whether or not the EU will have any going forward.",FXEmpire,Neutral,https://www.fxempire.com/forecasts/article/eur-chf-eur-usd-and-eur-gbp-forecasts-euro-in-focus-on-monday-1588489,"USA,Switzerland,United Kingdom,Europe",Article,
"Mon, 30 Mar 2026 07:40:23 -0400","EUR/USD Searching For the Bottom, And Here's Why A Rebound Won't Come Easy",EUR/USD has registered losses in the last four trading sessions in succession and an even deeper loss could be incoming.,InvestingCube,Negative,https://www.investingcube.com/forex/eur-usd-searching-for-the-bottom-and-heres-why-a-rebound-wont-come-easy/,"USA,Europe",Article,
"Mon, 30 Mar 2026 05:27:46 -0400",US Dollar Price Forecast: DXY Rises on Iran Tensions – GBP/USD and EUR/USD Outlook: Slips?,The US Dollar (DXY) climbs as Middle East tensions and rising oil prices fuel safe-haven demand. Will Jerome Powell and NFP data push the greenback even higher?,FXEmpire,Positive,https://www.fxempire.com/forecasts/article/us-dollar-price-forecast-dxy-rises-on-iran-tensions-gbp-usd-and-eur-usd-outlook-slips-1588327,"USA,DXY,United Kingdom,Europe",Article,
"Mon, 30 Mar 2026 04:51:25 -0400",EUR/USD –30.03.2026,  The Euro managed to hold trades inside a trading zone as expected in the past two weeks. Prices still face pressure towards the 1.1200 zone with resistances at 1.1655.,Orbex,Negative,https://www.orbex.com/blog/en/2026/03/eur-usd-30-03-2026,"USA,Europe",Article,
"Mon, 30 Mar 2026 04:42:36 -0400",EUR/USD: Middle East Conflict Still Determines Sentiment,"EUR/USD edged higher on Monday after earlier declines, reaching 1.1516. The US dollar continues to draw support from safe-haven demand amid the ongoing Middle East conflict, which has now entered its fifth week with no signs of resolution.",Action Forex,Neutral,https://www.actionforex.com/contributors/technical-analysis/635142-eur-usd-middle-east-conflict-still-determines-sentiment/,"USA,Europe",Article,
"Mon, 30 Mar 2026 03:30:00 -0400",Euro to Dollar Week-Ahead Forecast: EUR Held Below 1.15 as Oil Prices Boost USD,"The Euro to Dollar (EUR/USD) exchange rate trades near 1.1494 on Monday morning, holding steady on the day but close to recent lows after a softer trend through late March. The pair has retreated from levels above 1.16 earlier in the month, with recent price action signalling fading upside momentum.",ExchangeRates,Negative,https://www.exchangerates.org.uk/news/45593/2026-03-30-euro-to-dollar-week-ahead-forecast-eur-usd-near-1-15-as-oil-prices-boost-usd.html,"Oil,USA,Europe",Article,
"Mon, 30 Mar 2026 02:25:51 -0400",EUR/USD hovers near 1.1500 as markets brace for a long war,EUR/USD hovers near 1.1500 as markets brace for a long war,FX Street,Negative,https://www.fxstreet.com/news/eur-usd-hovers-near-11500-as-markets-brace-for-a-long-war-202603300625,"USA,Europe",Article,
"Mon, 30 Mar 2026 02:12:29 -0400",EUR/USD: Resilient as ECB activism priced – Commerzbank,EUR/USD: Resilient as ECB activism priced – Commerzbank,FX Street,Positive,https://www.fxstreet.com/news/eur-usd-resilient-as-ecb-activism-priced-commerzbank-202603300612,"USA,ECB,Europe",Article,
"Mon, 30 Mar 2026 01:39:07 -0400","FX Futures Positioning: US Dollar, EUR/USD, USD/JPY | COT report","Positioning in FX futures is beginning to shift in a meaningful way. The US dollar is attracting renewed demand, euro longs continue to unwind, and the Japanese yen has flipped decisively bearish.",Forexcom,Positive,https://www.forex.com/en-us/news-and-analysis/fx-futures-positioning-us-dollar-eur-usd-usd-jpy-cot-report/,"Japan,USA,Europe",Article,
"Sun, 29 Mar 2026 22:24:33 -0400",EUR/USD Price Forecast: Consolidates above one-week low; seems vulnerable near 1.1500,EUR/USD Price Forecast: Consolidates above one-week low; seems vulnerable near 1.1500,FX Street,Negative,https://www.fxstreet.com/news/eur-usd-price-forecast-consolidates-above-one-week-low-seems-vulnerable-near-11500-202603300224,"USA,Europe",Article,
"Sun, 29 Mar 2026 22:17:43 -0400","EUR/USD Under Pressure, Is Another Leg Lower Imminent?","Looking at the 4-hour chart, the pair settled below 1.1550, the 100 simple moving average (red, 4-hour), and the 200 simple moving average (green, 4-hour). Besides, it traded below a bullish trend line with support at 1.1520.",Action Forex,Negative,https://www.actionforex.com/contributors/technical-analysis/635070-eur-usd-under-pressure-is-another-leg-lower-imminent/,"USA,Europe",Article,
"Sun, 29 Mar 2026 19:12:22 -0400",EUR/USD slides below 1.1500 as Iran warns against potential US ground attacks,EUR/USD slides below 1.1500 as Iran warns against potential US ground attacks,FX Street,Negative,https://www.fxstreet.com/news/eur-usd-slides-below-11500-as-iran-warns-against-potential-us-ground-attacks-202603292312,"USA,Europe",Article,
"Sun, 29 Mar 2026 06:40:00 -0400",EUR/USD Weekly Forecast: Slide Lower and Important Support Now Contemplated - 29 March 2026,"A finish around the 1.15103 mark going into this weekend, after the 1.16300 vicinity was seen on Wednesday demonstrates the shifting sentiment that shadows the broad Forex market.",DailyForex,Negative,https://www.dailyforex.com/forex-technical-analysis/2026/03/eurusd-weekly-forecast-29th-march-to-3rd-april-2026/243167,"USA,Europe",Article,
"Sat, 28 Mar 2026 18:00:08 -0400","Euro Weekly Forecast: EUR/USD, EUR/JPY, EUR/GBP","If we go back to late-January there wasn't exactly a positive economic backdrop around the Eurozone, and it wasn't even all that bearish around the US and the USD. But a stunning sell-off in USD/JPY drove the US Dollar to its most oversold in five years and, in-turn, EUR/USD to deep overbought level as the pair tested above the 1.2000 handle.",Forexcom,Negative,https://www.forex.com/en-us/news-and-analysis/euro-weekly-forecast-eur-usd-eur-jpy-eur-gbp/,"Japan,USA,United Kingdom,Europe",Article,
"Fri, 27 Mar 2026 14:52:05 -0400",Euro Q2 Outlook: EUR/USD Selloff Accelerates – Where Is the Bottom?,"Euro rallied into key technical resistance in January before reversing sharply lower with March marking the second consecutive monthly decline in EUR/USD. Rising inflation concerns, a war in Iran, and a major shift in interest rate expectations have continued to support the US Dollar.",Forexcom,Negative,https://www.forex.com/en-us/news-and-analysis/euro-q2-outlook-eur-usd-selloff-accelerates-where-is-the-bottom-3-27-2026/,"USA,Europe",Article,
"Fri, 27 Mar 2026 14:28:13 -0400","USD/JPY Breaks 160, USD Ascending Triangle and EUR/USD 1.1500 Support Test","USD/JPY has broken above the 160 handle for the first time since 2024 and this sets up for a volatile Sunday open. Meanwhile, the US Dollar retains breakout potential given the ascending triangle formation and for those looking to fade DXY, EUR/USD is grasping at the 1.1500 level.",Forexcom,Positive,https://www.forex.com/en-us/news-and-analysis/usd-jpy-breaks-160-usd-ascending-triangle-and-eur-usd-1-1500-support-test/,"Japan,USA,Europe",Article,
"Fri, 27 Mar 2026 13:05:19 -0400","U.S. Dollar Tests New Highs As WTI Oil Climbs Towards $100: Analysis For EUR/USD, GBP/USD, USD/CAD, USD/JPY",The American currency is moving higher amid rising demand for safe-haven assets.,FXEmpire,Positive,https://www.fxempire.com/forecasts/article/u-s-dollar-tests-new-highs-as-wti-oil-climbs-towards-100-analysis-for-eur-usd-gbp-usd-usd-cad-usd-jpy-1588161,"Japan,Oil,USA,Canada,United Kingdom,Europe",Article,
"Fri, 27 Mar 2026 11:34:47 -0400",EUR/USD edges higher as Dollar takes breather after weekly surge,EUR/USD edges higher as Dollar takes breather after weekly surge,FX Street,Positive,https://www.fxstreet.com/news/eur-usd-edges-higher-as-dollar-takes-breather-after-weekly-surge-202603271534,"USA,Europe",Article,
"Fri, 27 Mar 2026 10:15:18 -0400",EUR/USD: Soft tone but 1.14 base holds – Scotiabank,EUR/USD: Soft tone but 1.14 base holds – Scotiabank,FX Street,Neutral,https://www.fxstreet.com/news/eur-usd-soft-tone-but-114-base-holds-scotiabank-202603271415,"USA,Europe",Article,
"Fri, 27 Mar 2026 10:11:08 -0400",EUR/USD forecast: Trump loses grip on markets amid re-escalation of tensions | Forex Friday,"Risk sentiment remained downbeat in the first half of Friday's session, as the drop in oil prices proved to be short-lived after Trump extended the pause in planned strikes on Iran's energy plants. Crude oil prices climbed a further 4% to extend its surge as fighting continues.",Forexcom,Negative,https://www.forex.com/en-us/news-and-analysis/eur-usd-forecast-trump-loses-grip-on-markets-amid-re-escalation-of-tensions-forex-friday/,"USA,Europe",Article,
"Fri, 27 Mar 2026 09:56:59 -0400","EUR/USD, USD/CAD and USD/CHF Forecasts – US Dollar Rises with Higher Rates in the US","US dollar continues to be a big winner overall, as the interest rates in the US continue to climb.",FXEmpire,Negative,https://www.fxempire.com/forecasts/article/eur-usd-usd-cad-and-usd-chf-forecasts-us-dollar-rises-with-higher-rates-in-the-us-1588116,"USA,Canada,Switzerland,Europe",Article,
"Fri, 27 Mar 2026 09:29:13 -0400",EUR/USD –27.03.2026,THE Euro managed to hold trades inside a trading zone as expected last week. Prices still face pressure towards the 1.1200 zone with resistances at 1.1655.,Orbex,Neutral,https://www.orbex.com/blog/en/2026/03/eur-usd-27-03-2026,"USA,Europe",Article,
"Fri, 27 Mar 2026 09:15:00 -0400",EUR/USD Price Analysis – EUR Drops Against the US Dollar - 27 March 2026,"EUR/USD is stuck in a tight 1.15–1.16 range, with sellers fading rallies near resistance as interest rate differentials and safety flows keep pressure on the euro.",DailyForex,Negative,https://www.dailyforex.com/forex-technical-analysis/2026/03/euro-usd-analysis-27-march-2026/243139,"USA,Europe",Article,
"Fri, 27 Mar 2026 08:45:01 -0400",EUR/USD: Vulnerable as risks tighten – ING,EUR/USD: Vulnerable as risks tighten – ING,FX Street,Negative,https://www.fxstreet.com/news/eur-usd-vulnerable-as-risks-tighten-ing-202603271245,"USA,Europe",Article,
"Fri, 27 Mar 2026 07:10:55 -0400",US Dollar Price Forecast: Hawkish Fed Risks Rally – Will GBP/USD and EUR/USD Crash?,"The Dollar Index battles a descending triangle at 100.142. With bullish momentum building, will a DXY breakout crush the Euro and Sterling?",FXEmpire,Positive,https://www.fxempire.com/forecasts/article/us-dollar-price-forecast-hawkish-fed-risks-rally-will-gbp-usd-and-eur-usd-crash-1587995,"USA,United Kingdom,Europe",Article,
"Fri, 27 Mar 2026 06:31:07 -0400",EUR/USD remains depressed near 1.1500 as risk aversion persists,EUR/USD remains depressed near 1.1500 as risk aversion persists,FX Street,Negative,https://www.fxstreet.com/news/eur-usd-remains-depressed-near-11500-as-risk-aversion-persists-202603271031,"USA,Europe",Article,
"Fri, 27 Mar 2026 04:57:47 -0400",EUR/USD: War-driven forecasts and softer Dollar outlook – Commerzbank,EUR/USD: War-driven forecasts and softer Dollar outlook – Commerzbank,FX Street,Positive,https://www.fxstreet.com/news/eur-usd-war-driven-forecasts-and-softer-dollar-outlook-commerzbank-202603270857,"USA,Europe",Article,
"Fri, 27 Mar 2026 04:28:24 -0400",Intraday Analysis 27.03.2026,"EURUSD hits resistance The euro pulled back from its recent rally after prices hit firm resistance. On the chart, a bounce away from the 1.1600 level suggests that a correction is due after a long bullish rally.",Orbex,Negative,https://www.orbex.com/blog/en/2026/03/intraday-analysis-27-03-2026,,Article,
"Fri, 27 Mar 2026 04:12:53 -0400",EUR/USD Price Forecast: Resumes downside after failing to hold above 200-day EMA,EUR/USD Price Forecast: Resumes downside after failing to hold above 200-day EMA,FX Street,Negative,https://www.fxstreet.com/news/eur-usd-price-forecast-resumes-downside-after-failing-to-hold-above-200-day-ema-202603270812,"USA,Europe",Article,
"Fri, 27 Mar 2026 03:23:15 -0400","Chart Alert: EUR/USD Found Support Above 1.1495, Potential Push Up Towards “Expanding Wedge” Range Resistance","The initial pop-up in US dollar strength following the FOMC meeting last Wednesday, 18 March 2026, does not have a clear positive follow-through, as the US Dollar Index remains trapped within a complex medium-term sideways range configuration that has been in place since 29 May 2025.",Action Forex,Positive,https://www.actionforex.com/contributors/technical-analysis/634878-chart-alert-eur-usd-found-support-above-1-1495-potential-push-up-towards-expanding-wedge-range-resistance/,"USA,Europe",Article,
"Fri, 27 Mar 2026 02:36:00 -0400","Chart alert: EUR/USD found support above 1.1495, potential push up towards “Expanding Wedge” range resistance","EUR/USD is stabilising above the key 1.1495 support as fading US dollar momentum and a hawkish European Central Bank outlook drive potential upside. The US Dollar Index remains capped near resistance, while narrowing discount yield spreads favour the euro.",MarketPulse,Positive,https://www.marketpulse.com/markets/chart-alert-eurusd-found-support-above-11495-potential-push-up-towards-expanding-wedge-range-resistance/,"USA,Europe",Article,
"Fri, 27 Mar 2026 02:10:36 -0400",EUR/USD: Recovery delayed by Iran conflict – Commerzbank,EUR/USD: Recovery delayed by Iran conflict – Commerzbank,FX Street,Negative,https://www.fxstreet.com/news/eur-usd-recovery-delayed-by-iran-conflict-commerzbank-202603270610,"USA,Europe",Article,
"Thu, 26 Mar 2026 22:26:01 -0400",EUR/USD inches up after Trump's Hormuz deadline extension; remains below mid-1.1500s,EUR/USD inches up after Trump's Hormuz deadline extension; remains below mid-1.1500s,FX Street,Neutral,https://www.fxstreet.com/news/eur-usd-inches-up-after-trumps-hormuz-deadline-extension-remains-below-mid-11500s-202603270226,"USA,Europe",Article,
"Thu, 26 Mar 2026 14:30:38 -0400",EUR/USD extends losses as geopolitical risks keep USD firmly bid,EUR/USD extends losses as geopolitical risks keep USD firmly bid,FX Street,Negative,https://www.fxstreet.com/news/eur-usd-extends-losses-as-geopolitical-risks-keep-usd-firmly-bid-202603261830,"USA,Europe",Article,
"Thu, 26 Mar 2026 12:19:10 -0400","U.S. Dollar Moves Higher Amid Rising Demand For Safe-Haven Assets: Analysis For EUR/USD, GBP/USD, USD/CAD, USD/JPY","The American currency gains ground, supported by the war in the Middle East.",FXEmpire,Positive,https://www.fxempire.com/forecasts/article/u-s-dollar-moves-higher-amid-rising-demand-for-safe-haven-assets-analysis-for-eur-usd-gbp-usd-usd-cad-usd-jpy-1587883,"Japan,USA,Canada,United Kingdom,Europe",Article,
"Thu, 26 Mar 2026 11:03:00 -0400","Euro Technical Outlook: EUR/USD Grind Continues, EUR/JPY Brews Bull Pennant","After a jarring sell-off drove EUR/USD from above 1.2000 to below 1.1500, there's been an almost eerie sense of quiet over the past two weeks. At this stage the pair can be approached in either direction depending on time frame and vantage point and there's a valid case for both bulls and bears with a seeming overhang from the ongoing conflict in the Middle East.",Forexcom,Neutral,https://www.forex.com/en-us/news-and-analysis/euro-technical-outlook-eur-usd-grind-continues-eur-jpy-brews-bull-pennant/,"Japan,USA,Europe",Article,
"Thu, 26 Mar 2026 10:47:18 -0400","Logical Skepticism for Peace Pulls the Petrodollar Higher – EUR/USD, AUD/USD and Dollar Index (DXY) Overview","The new Fed Chair elect, Hawkish repricings, Petrodollars, and a general backing away from risky trades built up sudden demand, particularly at a time when Asset Managers were the most bearish on the USD in 14 years – and when the Market is stuck on one side of a trade, it often results in huge reversals.",Action Forex,Positive,https://www.actionforex.com/contributors/technical-analysis/634804-logical-skepticism-for-peace-pulls-the-petrodollar-higher-eur-usd-aud-usd-and-dollar-index-dxy-overview/,"Australia,USA,DXY,Europe",Article,
"Thu, 26 Mar 2026 10:19:00 -0400","Logical skepticism for peace pulls the Petrodollar higher – EUR/USD, AUD/USD and Dollar Index (DXY) overview","US Dollar, AUD/USD and EUR/USD Analysis: The Global Reserve currency holds strong as the Petrodollar correlation returns and sentiment worsens. With WTI Oil rebounding toward the pivotal $95 level and a massive US Marine fleet arriving in the Arabian Sea, market sentiment quickly sours.",MarketPulse,Positive,https://www.marketpulse.com/markets/traders-doubt-us-iran-peace-usd-back-on-top-overview/,"Australia,USA,DXY,Europe",Article,
"Thu, 26 Mar 2026 08:25:42 -0400","EUR/USD, USD/JPY and AUD/USD Forecasts – Currencies on Hold at the Moment","The currency markets continue to see a lot of noise, but early on Thursday, it seems like we are simply waiting for some kind of catalyst.",FXEmpire,Neutral,https://www.fxempire.com/forecasts/article/eur-usd-usd-jpy-and-aud-usd-forecasts-currencies-on-hold-at-the-moment-1587817,"Australia,Japan,USA,Europe",Article,
"Thu, 26 Mar 2026 07:16:12 -0400",The Dusk of the Petrodollar Age,"Rising oil prices, triggered by Iran's rejection of Donald Trump's 15-point plan, have sent the EURUSD lower. Tehran does not consider itself to have lost the war and is putting forward its own demands.",Action Forex,Negative,https://www.actionforex.com/contributors/fundamental-analysis/634766-the-dusk-of-the-petrodollar-age/,,Article,
"Thu, 26 Mar 2026 06:23:33 -0400",EUR/USD –26.03.2026,THE Euro managed to hold trades inside a trading zone as expected last week. Prices still face pressure towards the 1.1200 zone with resistances at 1.1655.,Orbex,Negative,https://www.orbex.com/blog/en/2026/03/eur-usd-26-03-2026,"USA,Europe",Article,
"Thu, 26 Mar 2026 06:05:20 -0400",EUR/USD holds losses near 1.1550 amid fading hopes of a US-Iran peace deal,EUR/USD holds losses near 1.1550 amid fading hopes of a US-Iran peace deal,FX Street,Negative,https://www.fxstreet.com/news/eur-usd-holds-losses-near-11550-amid-fading-hopes-of-a-us-iran-peace-deal-202603261005,"USA,Europe",Article,
"Thu, 26 Mar 2026 06:01:42 -0400",EUR/USD: Downside bias within broad range – UOB,EUR/USD: Downside bias within broad range – UOB,FX Street,Negative,https://www.fxstreet.com/news/eur-usd-downside-bias-within-broad-range-uob-202603261001,"USA,Europe",Article,
"Thu, 26 Mar 2026 04:57:18 -0400",EUR/USD: Rally vulnerable without Gulf de-escalation – ING,EUR/USD: Rally vulnerable without Gulf de-escalation – ING,FX Street,Negative,https://www.fxstreet.com/news/eur-usd-rally-vulnerable-without-gulf-de-escalation-ing-202603260857,"USA,Europe",Article,
